{
  "alias" : "SI003-028_18S",
  "accession" : "ERS6351992",
  "centerName" : "MATIS OHF.",
  "title" : "Icelandic seawater",
  "description" : "2014-05-17_SI3_290_20m",
  "organism" : {
    "taxonId" : "408172",
    "commonName" : "marine metagenome",
    "scientificName" : "marine metagenome"
  },
  "attributes" : [ {
    "tag" : "Depth",
    "value" : "20",
    "unit" : "m"
  }, {
    "tag" : "environment (biome)",
    "value" : "ENVO:00000447"
  }, {
    "tag" : "environment (feature)",
    "value" : "ENVO:00002149"
  }, {
    "tag" : "environment (material)",
    "value" : "ENVO:00002010"
  }, {
    "tag" : "environmental package",
    "value" : "water"
  }, {
    "tag" : "Event Date/Time",
    "value" : "2014-05-17T21:00:00Z/2014-05-17T21:17:00Z"
  }, {
    "tag" : "Latitude Start",
    "value" : "66.5436",
    "unit" : "DD"
  }, {
    "tag" : "Longitude Start",
    "value" : "-18.8442",
    "unit" : "DD"
  }, {
    "tag" : "Marine Region",
    "value" : "North Atlantic Ocean"
  }, {
    "tag" : "project name",
    "value" : "MIME"
  }, {
    "tag" : "Protocol Label",
    "value" : "NPL022"
  }, {
    "tag" : "Salinity",
    "value" : "35.0273",
    "unit" : "psu"
  }, {
    "tag" : "Sampling Campaign",
    "value" : "B4-2014"
  }, {
    "tag" : "Sampling Platform",
    "value" : "Research Vessel Bjarni Saemundsson"
  }, {
    "tag" : "Sampling Site",
    "value" : "SI3"
  }, {
    "tag" : "Temperature",
    "value" : "6.1955",
    "unit" : "ÂºC"
  }, {
    "tag" : "ENA-CHECKLIST",
    "value" : "ERC000027"
  } ]
}