{
  "alias" : "ERR4918427_bin.2_MetaWRAP_v1.1_bin",
  "accession" : "ERS14375384",
  "centerName" : "UNIVERSITY OF COPENHAGEN",
  "title" : "Binned metagenome: ERR4918427_bin.2_MetaWRAP_v1.1_bin",
  "description" : "This sample represents a binned metagenome assembled from the metagenomic run ERR4918427 of study ERP125469.",
  "organism" : {
    "taxonId" : "1378299",
    "commonName" : "",
    "scientificName" : "Photobacterium piscicola"
  },
  "attributes" : [ {
    "tag" : "taxonomic classification",
    "value" : "The taxonomy of this binned metagenome was originally computed with GTDBtk, which assigned the following taxonomic annotation: d__Bacteria;p__Proteobacteria;c__Gammaproteobacteria;o__Vibrionales;f__Vibrionaceae;g__Photobacterium;s__Photobacterium piscicola"
  }, {
    "tag" : "project name",
    "value" : "HoloFood Salmon - Metagenome"
  }, {
    "tag" : "sequencing method",
    "value" : "DNBSEQ-G400"
  }, {
    "tag" : "assembly software",
    "value" : "metaSPAdes v3.14.1"
  }, {
    "tag" : "binning software",
    "value" : "MetaWRAP v1.1"
  }, {
    "tag" : "binning parameters",
    "value" : "MaxBin2, MetaBat2, Concoct with default parameter of the metaWRAP pipeline. Bin refinement module used from metaWRAP with default parameters."
  }, {
    "tag" : "completeness software",
    "value" : "CheckM"
  }, {
    "tag" : "completeness score",
    "value" : "59.57",
    "unit" : "%"
  }, {
    "tag" : "contamination score",
    "value" : "2.06",
    "unit" : "%"
  }, {
    "tag" : "isolation_source",
    "value" : "fish gut metagenome"
  }, {
    "tag" : "collection date",
    "value" : "2019-08-12"
  }, {
    "tag" : "geographic location (country and/or sea)",
    "value" : "Norway"
  }, {
    "tag" : "geographic location (latitude)",
    "value" : "66.0799",
    "unit" : "DD"
  }, {
    "tag" : "geographic location (longitude)",
    "value" : "12.587848",
    "unit" : "DD"
  }, {
    "tag" : "broad-scale environmental context",
    "value" : "Salmon digestive system"
  }, {
    "tag" : "local environmental context",
    "value" : "Digestive tube"
  }, {
    "tag" : "environmental medium",
    "value" : "Gut"
  }, {
    "tag" : "sample derived from",
    "value" : "SAMEA7687898"
  }, {
    "tag" : "metagenomic source",
    "value" : "fish gut metagenome"
  }, {
    "tag" : "taxonomic identity marker",
    "value" : "multi-marker approach"
  }, {
    "tag" : "investigation type",
    "value" : "metagenome-assembled genome"
  }, {
    "tag" : "ENA-CHECKLIST",
    "value" : "ERC000050"
  } ]
}