{
  "alias" : "S15BD10196",
  "accession" : "ERS6247546",
  "centerName" : "Sciensano",
  "title" : "clinical sample Shigella sonnei",
  "description" : "faeces",
  "organism" : {
    "taxonId" : "624",
    "scientificName" : "Shigella sonnei"
  },
  "attributes" : [ {
    "tag" : "collected_by",
    "value" : "NRCSS Belgium at Sciensano"
  }, {
    "tag" : "collection_date",
    "value" : "2015-12-03"
  }, {
    "tag" : "geographic location (country and/or sea)",
    "value" : "Belgium"
  }, {
    "tag" : "host scientific name",
    "value" : "Home sapiens"
  }, {
    "tag" : "isolate",
    "value" : "clinical"
  }, {
    "tag" : "patient gender",
    "value" : "Male"
  }, {
    "tag" : "year",
    "value" : "2015"
  }, {
    "tag" : "ENA-CHECKLIST",
    "value" : "ERC000044"
  } ]
}