{
  "alias" : "T1RIBP4",
  "accession" : "ERS14272511",
  "centerName" : "UNIVERSITY OF BOLOGNA",
  "title" : "T1RIBP4",
  "description" : "Rhizosphere",
  "organism" : {
    "taxonId" : "29760",
    "commonName" : "wine grape",
    "scientificName" : "Vitis vinifera"
  },
  "attributes" : [ {
    "tag" : "broad-scale environmental context",
    "value" : "Vineyard"
  }, {
    "tag" : "collection date",
    "value" : "not collected"
  }, {
    "tag" : "environmental medium",
    "value" : "Soil"
  }, {
    "tag" : "geographic location (country and/or sea)",
    "value" : "Italy"
  }, {
    "tag" : "geographic location (latitude)",
    "value" : "44.82",
    "unit" : "DD"
  }, {
    "tag" : "geographic location (longitude)",
    "value" : "11.06",
    "unit" : "DD"
  }, {
    "tag" : "local environmental context",
    "value" : "Rhizosphere"
  }, {
    "tag" : "project name",
    "value" : "PRJEB57815"
  }, {
    "tag" : "ENA-CHECKLIST",
    "value" : "ERC000020"
  } ]
}