{
  "alias" : "DTU2016-1144-PRJ1066-RL-Sewage-78_S12_L001",
  "accession" : "ERS1215584",
  "centerName" : "DTU",
  "title" : "Danish sewage",
  "organism" : {
    "taxonId" : "527639",
    "scientificName" : "wastewater metagenome"
  },
  "attributes" : [ {
    "tag" : "collection date",
    "value" : "2016-04-02"
  }, {
    "tag" : "geographic location (country and/or sea)",
    "value" : "Denmark"
  }, {
    "tag" : "geographic location (latitude)",
    "value" : "55.694986",
    "unit" : "DD"
  }, {
    "tag" : "geographic location (longitude)",
    "value" : "12.615025999999943",
    "unit" : "DD"
  }, {
    "tag" : "investigation type",
    "value" : "metagenome"
  }, {
    "tag" : "name of the sampling site",
    "value" : "Renseanl√¶g Lynetten"
  }, {
    "tag" : "sewage type",
    "value" : "Waste water treatment plant"
  }, {
    "tag" : "ENA-CHECKLIST",
    "value" : "ERC000036"
  } ]
}