{
  "alias" : "Sample_14",
  "accession" : "ERS10394985",
  "centerName" : "Perinatal laboratory at the Centre for Perinatal Medicine & Health",
  "title" : "Sample14",
  "description" : "Vaginal metatranscriptome preterm",
  "organism" : {
    "taxonId" : "1632839",
    "scientificName" : "human vaginal metagenome"
  },
  "attributes" : [ {
    "tag" : "collection date",
    "value" : "not provided"
  }, {
    "tag" : "environment (biome)",
    "value" : "human"
  }, {
    "tag" : "environment (feature)",
    "value" : "vagina"
  }, {
    "tag" : "environment (material)",
    "value" : "swab"
  }, {
    "tag" : "geographic location (country and/or sea)",
    "value" : "Sweden"
  }, {
    "tag" : "geographic location (latitude)",
    "value" : "57.708883",
    "unit" : "DD"
  }, {
    "tag" : "geographic location (longitude)",
    "value" : "11.974573",
    "unit" : "DD"
  }, {
    "tag" : "human vaginal environmental package",
    "value" : "human-vaginal"
  }, {
    "tag" : "investigation type",
    "value" : "metatranscriptome"
  }, {
    "tag" : "project name",
    "value" : "Microbial transcriptome in vaginal fluid at midgestation: association with spontaneous preterm delivery"
  }, {
    "tag" : "sequencing method",
    "value" : "Illumina NovaSeq"
  }, {
    "tag" : "ENA-CHECKLIST",
    "value" : "ERC000018"
  } ]
}