{
  "alias": "L-CC-C2-1",
  "accession": "ERS5415995",
  "centerName": "University of Southampton",
  "title": "L-CC-C2-1",
  "description": "COI Control 2",
  "organism": {
    "taxonId": "256318",
    "scientificName": "metagenome"
  },
  "attributes": [
    {
      "tag": "collection date",
      "value": "2018-01-01"
    },
    {
      "tag": "environment (biome)",
      "value": "marine benthic"
    },
    {
      "tag": "environment (feature)",
      "value": "submarine canyon"
    },
    {
      "tag": "environment (material)",
      "value": "sediment"
    },
    {
      "tag": "geographic location (country and/or sea)",
      "value": "Mediterranean Sea"
    },
    {
      "tag": "geographic location (depth)",
      "value": "0",
      "unit": "m"
    },
    {
      "tag": "geographic location (elevation)",
      "value": "0",
      "unit": "m"
    },
    {
      "tag": "geographic location (latitude)",
      "value": "50.892",
      "unit": "DD"
    },
    {
      "tag": "geographic location (longitude)",
      "value": "-1.3942",
      "unit": "DD"
    },
    {
      "tag": "investigation type",
      "value": "metagenome"
    },
    {
      "tag": "project name",
      "value": "CC.19.LH"
    },
    {
      "tag": "sediment environmental package",
      "value": "sediment"
    },
    {
      "tag": "sequencing method",
      "value": "Illumina MiSeq"
    },
    {
      "tag": "ENA-CHECKLIST",
      "value": "ERC000021"
    }
  ]
}