{
  "alias": "M13.3842",
  "accession": "ERS737888",
  "centerName": "Malawi College of Medicine",
  "title": "mlab",
  "description": "adult",
  "organism": {
    "taxonId": "1131769",
    "scientificName": "human nasal/pharyngeal metagenome"
  },
  "attributes": [
    {
      "tag": "investigation type",
      "value": "metagenome"
    },
    {
      "tag": "project name",
      "value": "Malawi nasopharyngeal microbiome"
    },
    {
      "tag": "sequencing method",
      "value": "pyrosequencing"
    },
    {
      "tag": "collection date",
      "value": "2003"
    },
    {
      "tag": "human-associated environmental package",
      "value": "human-associated"
    },
    {
      "tag": "geographic location (latitude)",
      "value": "-15.80127",
      "unit": "DD"
    },
    {
      "tag": "geographic location (longitude)",
      "value": "+35.021813",
      "unit": "DD"
    },
    {
      "tag": "geographic location (country and/or sea)",
      "value": "Malawi"
    },
    {
      "tag": "environment (biome)",
      "value": "head"
    },
    {
      "tag": "environment (feature)",
      "value": "nasal"
    },
    {
      "tag": "environment (material)",
      "value": "mucosal"
    },
    {
      "tag": "barcode_sequence",
      "value": "AGACCGTCAGAC"
    },
    {
      "tag": "linker_primer_sequence",
      "value": "CCGTCAATTCMTTTRAGT"
    },
    {
      "tag": "sample_area",
      "value": "null"
    },
    {
      "tag": "sample_age",
      "value": "null"
    },
    {
      "tag": "hiv_status",
      "value": "hivpos"
    },
    {
      "tag": "art_usage",
      "value": "null"
    },
    {
      "tag": "cd4_count-percentage",
      "value": "232"
    },
    {
      "tag": "pcv7_usage",
      "value": "PCV"
    },
    {
      "tag": "gender",
      "value": "null"
    },
    {
      "tag": "sampling_point",
      "value": "null"
    },
    {
      "tag": "description",
      "value": "Crossectional"
    },
    {
      "tag": "ENA-CHECKLIST",
      "value": "ERC000014"
    }
  ]
}