{
  "alias" : "19884916-f2a3-486c-ad92-b4f5549021f8",
  "accession" : "ERS14287222",
  "centerName" : "UNIVERSITY OF OXFORD",
  "title" : "Influenza genome sequencing",
  "organism" : {
    "taxonId" : "11320",
    "scientificName" : "Influenza A virus"
  },
  "attributes" : [ {
    "tag" : "ENA-CHECKLIST",
    "value" : "ERC000032"
  }, {
    "tag" : "collection date",
    "value" : "2022-11"
  }, {
    "tag" : "geographic location (country and/or sea)",
    "value" : "United Kingdom"
  }, {
    "tag" : "host common name",
    "value" : "human"
  }, {
    "tag" : "host subject id",
    "value" : "not collected"
  }, {
    "tag" : "host health state",
    "value" : "not collected"
  }, {
    "tag" : "host sex",
    "value" : "not collected"
  }, {
    "tag" : "host scientific name",
    "value" : "Homo sapien"
  }, {
    "tag" : "influenza test method",
    "value" : "RT-PCR"
  }, {
    "tag" : "influenza test result",
    "value" : "P"
  }, {
    "tag" : "other pathogens tested",
    "value" : "none"
  }, {
    "tag" : "other pathogens test result",
    "value" : "not applicable"
  }, {
    "tag" : "collector name",
    "value" : "Modernising Medical Microbiology"
  }, {
    "tag" : "collecting institution",
    "value" : "University of Oxford"
  } ]
}