{
  "alias" : "CB05_02F1a_metaG",
  "accession" : "ERS4789468",
  "centerName" : "UNIVERSITY OF COPENHAGEN",
  "title" : "CB05.02F1a",
  "description" : "chicken MAG catalogue data from Caecum content; animal CB05.02 from cage CB05 with treatment CO",
  "organism" : {
    "taxonId" : "506600",
    "scientificName" : "chicken gut metagenome"
  },
  "attributes" : [ {
    "tag" : "adapters",
    "value" : "AAGTCGGAGGCCAAGCGGTCTTAGGAAGACAA;GAACGACATGGCTACGATCCGACTT"
  }, {
    "tag" : "collection date",
    "value" : "2019-05-06"
  }, {
    "tag" : "geographic location (country and/or sea)",
    "value" : "Spain"
  }, {
    "tag" : "geographic location (latitude)",
    "value" : "41.170047",
    "unit" : "DD"
  }, {
    "tag" : "geographic location (longitude)",
    "value" : "1.168491",
    "unit" : "DD"
  }, {
    "tag" : "geographic location (region and locality)",
    "value" : "El Morell; Tarragona"
  }, {
    "tag" : "host body site",
    "value" : "Caecum content"
  }, {
    "tag" : "host breed",
    "value" : "Ross"
  }, {
    "tag" : "host common name",
    "value" : "Chicken"
  }, {
    "tag" : "host diet",
    "value" : "unknown"
  }, {
    "tag" : "host diet treatment",
    "value" : "Probiotic"
  }, {
    "tag" : "host disease status",
    "value" : "N/A"
  }, {
    "tag" : "host scientific name",
    "value" : "Gallus gallus"
  }, {
    "tag" : "host sex",
    "value" : "female"
  }, {
    "tag" : "host subject id",
    "value" : "CB05.02"
  }, {
    "tag" : "host taxid",
    "value" : "9031"
  }, {
    "tag" : "host total mass",
    "value" : "172.50",
    "unit" : "g"
  }, {
    "tag" : "nucleic acid extraction",
    "value" : "D-rex protocol"
  }, {
    "tag" : "pcr primers",
    "value" : "N/A"
  }, {
    "tag" : "project name",
    "value" : "HoloFood Chicken - MAG Catalogue from Caecum content"
  }, {
    "tag" : "reference host genome for decontamination",
    "value" : "GCA_000000000.0"
  }, {
    "tag" : "sample storage buffer",
    "value" : "Shield"
  }, {
    "tag" : "sample storage container",
    "value" : "E-matrix 2ml"
  }, {
    "tag" : "sample storage location",
    "value" : "UCPH"
  }, {
    "tag" : "sample storage temperature",
    "value" : "-20",
    "unit" : "°C"
  }, {
    "tag" : "sample volume or weight for DNA extraction",
    "value" : "0.2",
    "unit" : "mL"
  }, {
    "tag" : "sequencing method",
    "value" : "MGISEQ-2000"
  }, {
    "tag" : "trial length",
    "value" : "35",
    "unit" : "days"
  }, {
    "tag" : "trial timepoint",
    "value" : "7",
    "unit" : "days"
  }, {
    "tag" : "host storage container temperature",
    "value" : "21",
    "unit" : "°C"
  }, {
    "tag" : "ENA-CHECKLIST",
    "value" : "ERC000052"
  } ]
}