{
  "alias" : "JC21-P4-5_S252_L001_R1_001",
  "accession" : "ERS13664092",
  "centerName" : "UNIVERSITY OF BERGEN/DEPT. OF BIOLOGY",
  "title" : "JC2_1_P4_0005m",
  "description" : "16S_amplicon_sequences_from_the_JC2_1_cruise_2021_Nansen_Legacy",
  "organism" : {
    "taxonId" : "1561972",
    "scientificName" : "seawater metagenome"
  },
  "attributes" : [ {
    "tag" : "broad-scale environmental context",
    "value" : "Barent's_Sea"
  }, {
    "tag" : "Depth",
    "value" : "5",
    "unit" : "m"
  }, {
    "tag" : "environmental medium",
    "value" : "water"
  }, {
    "tag" : "environmental package",
    "value" : "water"
  }, {
    "tag" : "Event Date/Time Start",
    "value" : "2021-07-18"
  }, {
    "tag" : "Latitude Start",
    "value" : "79.75",
    "unit" : "DD"
  }, {
    "tag" : "local environmental context",
    "value" : "Norwegian_Barent's_Sea_East_and_North_of_Svalbard"
  }, {
    "tag" : "Longitude Start",
    "value" : "34",
    "unit" : "DD"
  }, {
    "tag" : "Marine Region",
    "value" : "Norwegian_Barent's_Sea_East_and_North_of_Svalbard"
  }, {
    "tag" : "project name",
    "value" : "Nansen_Legacy_Summer"
  }, {
    "tag" : "Protocol Label",
    "value" : "UiB"
  }, {
    "tag" : "Salinity Sensor",
    "value" : "33.08",
    "unit" : "psu"
  }, {
    "tag" : "Sampling Campaign",
    "value" : "The_Nansen_Legacy_JC2-1"
  }, {
    "tag" : "Sampling Platform",
    "value" : "RV_Kronprins_Haakon"
  }, {
    "tag" : "Sampling Station",
    "value" : "P4"
  }, {
    "tag" : "Temperature",
    "value" : "-0.09",
    "unit" : "ÂºC"
  }, {
    "tag" : "ENA-CHECKLIST",
    "value" : "ERC000030"
  } ]
}