{
  "alias" : "2865_1_11SJK246-04",
  "accession" : "ERS1252209",
  "centerName" : "NETHERLANDS CANCER INSTITUTE",
  "title" : "2865_1_11SJK246-04",
  "description" : "11SJK246-04 - CLC tissue",
  "organism" : {
    "taxonId" : "10090",
    "commonName" : "house mouse",
    "scientificName" : "Mus musculus"
  },
  "attributes" : [ {
    "tag" : "tissue_type",
    "value" : "mammary tumor"
  }, {
    "tag" : "sex",
    "value" : "female"
  }, {
    "tag" : "diagnosis",
    "value" : "classic invasive lobular carcinoma"
  }, {
    "tag" : "strain",
    "value" : "Wcre;Cdh1F/F;PtenF/F (FVB)"
  }, {
    "tag" : "ENA-CHECKLIST",
    "value" : "ERC000034"
  } ]
}