{
  "alias" : "PS103.14-26_S_0_LL",
  "accession" : "ERS14253507",
  "centerName" : "University of Duisburg-Essen",
  "title" : "S_0_LL",
  "description" : "clonal cell culture",
  "organism" : {
    "taxonId" : "186038",
    "scientificName" : "Fragilariopsis kerguelensis"
  },
  "attributes" : [ {
    "tag" : "block",
    "value" : "genotype at a certain temperature light setting"
  }, {
    "tag" : "dev_stage",
    "value" : "exponential growth"
  }, {
    "tag" : "ecotype",
    "value" : "most southern sample station and thus coldest region of distribution area"
  }, {
    "tag" : "environmental stress",
    "value" : "illumination"
  }, {
    "tag" : "experimental factor 1",
    "value" : "genotype"
  }, {
    "tag" : "experimental factor 2",
    "value" : "temperature"
  }, {
    "tag" : "genotype",
    "value" : "SOUTH"
  }, {
    "tag" : "growth condition",
    "value" : "0°C, low light (15–30 µmol/m2s)"
  }, {
    "tag" : "replicate",
    "value" : "biological"
  }, {
    "tag" : "sampling time point",
    "value" : "between 4 and 6 hr after light on"
  }, {
    "tag" : "strain",
    "value" : "PS103.14-26"
  }, {
    "tag" : "time",
    "value" : "> one period of exponential growth"
  }, {
    "tag" : "ENA-CHECKLIST",
    "value" : "ERC000035"
  } ]
}