{
  "alias" : "20201119CLOUDK3",
  "accession" : "ERS12389676",
  "centerName" : "CNRS",
  "title" : "20201119CLOUDK3",
  "organism" : {
    "taxonId" : "256318",
    "scientificName" : "metagenome"
  },
  "attributes" : [ {
    "tag" : "air environmental package",
    "value" : "air"
  }, {
    "tag" : "collection date",
    "value" : "2020-11-19"
  }, {
    "tag" : "environment (biome)",
    "value" : "temperate forest"
  }, {
    "tag" : "environment (feature)",
    "value" : "mountain"
  }, {
    "tag" : "environment (material)",
    "value" : "water"
  }, {
    "tag" : "geographic location (altitude)",
    "value" : "1465",
    "unit" : "m"
  }, {
    "tag" : "geographic location (country and/or sea)",
    "value" : "France"
  }, {
    "tag" : "geographic location (latitude)",
    "value" : "45.772",
    "unit" : "DD"
  }, {
    "tag" : "geographic location (longitude)",
    "value" : "2.9655",
    "unit" : "DD"
  }, {
    "tag" : "investigation type",
    "value" : "metagenome"
  }, {
    "tag" : "project name",
    "value" : "Cloud-Air-16S"
  }, {
    "tag" : "sequencing method",
    "value" : "Illumina MiSeq"
  }, {
    "tag" : "ENA-CHECKLIST",
    "value" : "ERC000012"
  } ]
}