{
  "alias" : "LX32-9_rep1",
  "accession" : "ERS11998473",
  "centerName" : "Centrum Medyczne Ksztalcenia Podyplomowego",
  "title" : "LX32-9_rep1",
  "description" : "HCT116 overexpression BAZ",
  "organism" : {
    "taxonId" : "9606",
    "commonName" : "human",
    "scientificName" : "Homo sapiens"
  },
  "attributes" : [ {
    "tag" : "engrafted tumor sample passage",
    "value" : "32"
  }, {
    "tag" : "patient age at collection of tumor",
    "value" : "48"
  }, {
    "tag" : "patient sex",
    "value" : "Male"
  }, {
    "tag" : "patient tumor diagnosis at time of collection",
    "value" : "48"
  }, {
    "tag" : "patient tumor primary site",
    "value" : ""
  }, {
    "tag" : "patient tumor site of collection",
    "value" : ""
  }, {
    "tag" : "patient tumor type",
    "value" : "Primary Neoplasm"
  }, {
    "tag" : "sample material",
    "value" : "cell suspension"
  }, {
    "tag" : "sample origin",
    "value" : "Xenograft derived cell line"
  }, {
    "tag" : "sample taxon name",
    "value" : "Homo sapiens/Mus musculus xenograft"
  }, {
    "tag" : "sample unique ID",
    "value" : "LX32"
  }, {
    "tag" : "Was the PDX model humanised?",
    "value" : "No"
  }, {
    "tag" : "ENA-CHECKLIST",
    "value" : "ERC000051"
  } ]
}